{
  "schema_version": "github.activity.report.v1",
  "generated_at": "2026-05-19T00:00:00+00:00",
  "shiplog_version": "0.9.0",
  "activity_id": "github_activity_example",
  "actor": "EffortlessSteven",
  "repo_owners": [
    "EffortlessMetrics",
    "EffortlessSteven"
  ],
  "query_strategy": "actor_search_owner_filter",
  "profile": "full",
  "state": "completed",
  "run_ref": "run_fixture",
  "source_run_dir": "out/github-full/run_fixture",
  "final_dir": "out/github-full/final",
  "final_outputs": [
    {
      "label": "packet",
      "path": "out/github-full/final/packet.md"
    },
    {
      "label": "intake_report",
      "path": "out/github-full/final/intake.report.json"
    },
    {
      "label": "coverage",
      "path": "out/github-full/final/coverage.manifest.json"
    },
    {
      "label": "ledger",
      "path": "out/github-full/final/ledger.events.jsonl"
    },
    {
      "label": "api_ledger",
      "path": "out/github-full/final/github.activity.api-ledger.json"
    }
  ],
  "github_api": {
    "requests": {
      "search": 84,
      "core": 312
    },
    "cache": {
      "search_probe": {
        "fresh_hits": 10,
        "stale_hits": 0,
        "misses": 14
      },
      "search_page": {
        "fresh_hits": 80,
        "stale_hits": 0,
        "misses": 84
      },
      "pull_detail": {
        "fresh_hits": 220,
        "stale_hits": 0,
        "misses": 88
      },
      "review_page": {
        "fresh_hits": 140,
        "stale_hits": 0,
        "misses": 66
      }
    },
    "rate_limit_snapshots": [
      {
        "resource": "search",
        "limit": 30,
        "remaining": 19,
        "used": 11,
        "reset_at": "2026-05-19T00:01:00+00:00",
        "observed_at": "2026-05-19T00:00:30+00:00"
      },
      {
        "resource": "core",
        "limit": 5000,
        "remaining": 4632,
        "used": 368,
        "reset_at": "2026-05-19T01:00:00+00:00",
        "observed_at": "2026-05-19T00:00:30+00:00"
      }
    ],
    "secondary_limit_events": []
  },
  "owner_filter": {
    "requested_owners": [
      "EffortlessMetrics",
      "EffortlessSteven"
    ],
    "query_strategy": "actor_search_owner_filter",
    "kept": {
      "EffortlessMetrics": 120,
      "EffortlessSteven": 44
    },
    "dropped": [
      {
        "owner": "other-owner",
        "count": 17,
        "reason": "owner_not_requested"
      }
    ]
  },
  "receipt_refs": [
    "github.activity.plan.json",
    "github.activity.progress.json",
    "github.activity.api-ledger.json",
    "run_fixture/intake.report.json",
    "run_fixture/coverage.manifest.json"
  ]
}
